{
  "schema_version": "1.0",
  "evaluation_id": "EVAL-RUN-2026-08-13-PRIMARY",
  "evaluated_at": "2026-08-13T01:26:34Z",
  "protocol": {
    "path": "evaluation/protocol-v1.0.json",
    "version": "1.0.0",
    "sha256": "23523b0d79f16cd06604c1db5966ba2b4100c53005e4cb45639870698053977d"
  },
  "corpus": {
    "path": "evaluation/corpus-manifest-v1.0.json",
    "version": "1.0.0",
    "sha256": "9e9eb0f1d5fa84f4926b7665cc5b3738c481a0caa0c11ad55ed4ae4df1142f59"
  },
  "overlap_matrix": {
    "path": "evaluation/baseline-overlap-v1.0.json",
    "version": "1.0.0",
    "sha256": "2e7652643f9df31b421567ac11138707ebc373522ad0cc1ce03b1bb74f6aad49"
  },
  "candidate": {
    "analyzer_revision": "6d71c99914a38b6e161bc9cf56407eb1757b8c9a",
    "package_version": "2.1.1",
    "rule_catalog_sha256": "5842caa836d7b8970ae9aef1261652cdd8f98a1c49598962de32be58c9e998a0"
  },
  "environment": {
    "python_version": "3.12.6",
    "platform": "macOS-26.3.1-arm64-arm-64bit",
    "command": [
      "python",
      "-m",
      "tools.evaluation_runner",
      "--write"
    ],
    "clean_worktree": true
  },
  "validity": {
    "valid": true,
    "issues": [
      "Non-gating limitation: the registered network reachability ablation was not estimable because the frozen corpus retained no reachability-context artifact."
    ]
  },
  "counts": {
    "case_count": 32,
    "scored_assertion_count": 168,
    "excluded_assertion_count": 8,
    "unlabelled_prediction_count": 2,
    "duplicate_prediction_count": 0,
    "matched_positive_count": 77,
    "severity_match_count": 77
  },
  "overall": {
    "confusion": {
      "true_positive": 77,
      "false_positive": 2,
      "false_negative": 1,
      "true_negative": 90
    },
    "scores": {
      "precision": 0.9746835443037974,
      "recall": 0.9871794871794872,
      "f1": 0.980891719745223,
      "specificity": 0.9782608695652174
    },
    "confidence_intervals": {
      "precision": {
        "lower": 0.9123141537110886,
        "upper": 0.9930296326934152
      },
      "recall": {
        "lower": 0.930891429982978,
        "upper": 0.9977332682461664
      },
      "specificity": {
        "lower": 0.9241650601730417,
        "upper": 0.9940179587711463
      }
    }
  },
  "per_module": [
    {
      "confusion": {
        "true_positive": 30,
        "false_positive": 0,
        "false_negative": 1,
        "true_negative": 30
      },
      "scores": {
        "precision": 1.0,
        "recall": 0.967741935483871,
        "f1": 0.9836065573770492,
        "specificity": 1.0
      },
      "confidence_intervals": {
        "precision": {
          "lower": 0.8864866068260312,
          "upper": 0.9999999999999999
        },
        "recall": {
          "lower": 0.838058948352751,
          "upper": 0.9942827784745831
        },
        "specificity": {
          "lower": 0.8864866068260312,
          "upper": 0.9999999999999999
        }
      },
      "module": "iam"
    },
    {
      "confusion": {
        "true_positive": 15,
        "false_positive": 2,
        "false_negative": 0,
        "true_negative": 21
      },
      "scores": {
        "precision": 0.8823529411764706,
        "recall": 1.0,
        "f1": 0.9375,
        "specificity": 0.9130434782608695
      },
      "confidence_intervals": {
        "precision": {
          "lower": 0.6566364940511412,
          "upper": 0.9671202262362074
        },
        "recall": {
          "lower": 0.7961166989641515,
          "upper": 1.0
        },
        "specificity": {
          "lower": 0.7320401892425634,
          "upper": 0.9758199955157796
        }
      },
      "module": "storage"
    },
    {
      "confusion": {
        "true_positive": 8,
        "false_positive": 0,
        "false_negative": 0,
        "true_negative": 10
      },
      "scores": {
        "precision": 1.0,
        "recall": 1.0,
        "f1": 1.0,
        "specificity": 1.0
      },
      "confidence_intervals": {
        "precision": {
          "lower": 0.6755924351161198,
          "upper": 1.0
        },
        "recall": {
          "lower": 0.6755924351161198,
          "upper": 1.0
        },
        "specificity": {
          "lower": 0.7224672001371107,
          "upper": 0.9999999999999999
        }
      },
      "module": "network"
    },
    {
      "confusion": {
        "true_positive": 24,
        "false_positive": 0,
        "false_negative": 0,
        "true_negative": 29
      },
      "scores": {
        "precision": 1.0,
        "recall": 1.0,
        "f1": 1.0,
        "specificity": 1.0
      },
      "confidence_intervals": {
        "precision": {
          "lower": 0.8620237953250198,
          "upper": 1.0
        },
        "recall": {
          "lower": 0.8620237953250198,
          "upper": 1.0
        },
        "specificity": {
          "lower": 0.8830302015002593,
          "upper": 1.0
        }
      },
      "module": "cloudtrail"
    }
  ],
  "per_rule": [
    {
      "confusion": {
        "true_positive": 2,
        "false_positive": 0,
        "false_negative": 0,
        "true_negative": 2
      },
      "scores": {
        "precision": 1.0,
        "recall": 1.0,
        "f1": 1.0,
        "specificity": 1.0
      },
      "confidence_intervals": {
        "precision": {
          "lower": 0.34238022750665303,
          "upper": 1.0
        },
        "recall": {
          "lower": 0.34238022750665303,
          "upper": 1.0
        },
        "specificity": {
          "lower": 0.34238022750665303,
          "upper": 1.0
        }
      },
      "module": "iam",
      "rule_id": "IAM-001"
    },
    {
      "confusion": {
        "true_positive": 2,
        "false_positive": 0,
        "false_negative": 0,
        "true_negative": 2
      },
      "scores": {
        "precision": 1.0,
        "recall": 1.0,
        "f1": 1.0,
        "specificity": 1.0
      },
      "confidence_intervals": {
        "precision": {
          "lower": 0.34238022750665303,
          "upper": 1.0
        },
        "recall": {
          "lower": 0.34238022750665303,
          "upper": 1.0
        },
        "specificity": {
          "lower": 0.34238022750665303,
          "upper": 1.0
        }
      },
      "module": "iam",
      "rule_id": "IAM-002"
    },
    {
      "confusion": {
        "true_positive": 2,
        "false_positive": 0,
        "false_negative": 0,
        "true_negative": 2
      },
      "scores": {
        "precision": 1.0,
        "recall": 1.0,
        "f1": 1.0,
        "specificity": 1.0
      },
      "confidence_intervals": {
        "precision": {
          "lower": 0.34238022750665303,
          "upper": 1.0
        },
        "recall": {
          "lower": 0.34238022750665303,
          "upper": 1.0
        },
        "specificity": {
          "lower": 0.34238022750665303,
          "upper": 1.0
        }
      },
      "module": "iam",
      "rule_id": "IAM-003"
    },
    {
      "confusion": {
        "true_positive": 2,
        "false_positive": 0,
        "false_negative": 0,
        "true_negative": 2
      },
      "scores": {
        "precision": 1.0,
        "recall": 1.0,
        "f1": 1.0,
        "specificity": 1.0
      },
      "confidence_intervals": {
        "precision": {
          "lower": 0.34238022750665303,
          "upper": 1.0
        },
        "recall": {
          "lower": 0.34238022750665303,
          "upper": 1.0
        },
        "specificity": {
          "lower": 0.34238022750665303,
          "upper": 1.0
        }
      },
      "module": "iam",
      "rule_id": "IAM-004"
    },
    {
      "confusion": {
        "true_positive": 2,
        "false_positive": 0,
        "false_negative": 1,
        "true_negative": 2
      },
      "scores": {
        "precision": 1.0,
        "recall": 0.6666666666666666,
        "f1": 0.8,
        "specificity": 1.0
      },
      "confidence_intervals": {
        "precision": {
          "lower": 0.34238022750665303,
          "upper": 1.0
        },
        "recall": {
          "lower": 0.2076596008020477,
          "upper": 0.9385080552796037
        },
        "specificity": {
          "lower": 0.34238022750665303,
          "upper": 1.0
        }
      },
      "module": "iam",
      "rule_id": "IAM-005"
    },
    {
      "confusion": {
        "true_positive": 2,
        "false_positive": 0,
        "false_negative": 0,
        "true_negative": 2
      },
      "scores": {
        "precision": 1.0,
        "recall": 1.0,
        "f1": 1.0,
        "specificity": 1.0
      },
      "confidence_intervals": {
        "precision": {
          "lower": 0.34238022750665303,
          "upper": 1.0
        },
        "recall": {
          "lower": 0.34238022750665303,
          "upper": 1.0
        },
        "specificity": {
          "lower": 0.34238022750665303,
          "upper": 1.0
        }
      },
      "module": "iam",
      "rule_id": "IAM-006"
    },
    {
      "confusion": {
        "true_positive": 2,
        "false_positive": 0,
        "false_negative": 0,
        "true_negative": 2
      },
      "scores": {
        "precision": 1.0,
        "recall": 1.0,
        "f1": 1.0,
        "specificity": 1.0
      },
      "confidence_intervals": {
        "precision": {
          "lower": 0.34238022750665303,
          "upper": 1.0
        },
        "recall": {
          "lower": 0.34238022750665303,
          "upper": 1.0
        },
        "specificity": {
          "lower": 0.34238022750665303,
          "upper": 1.0
        }
      },
      "module": "iam",
      "rule_id": "IAM-007"
    },
    {
      "confusion": {
        "true_positive": 2,
        "false_positive": 0,
        "false_negative": 0,
        "true_negative": 2
      },
      "scores": {
        "precision": 1.0,
        "recall": 1.0,
        "f1": 1.0,
        "specificity": 1.0
      },
      "confidence_intervals": {
        "precision": {
          "lower": 0.34238022750665303,
          "upper": 1.0
        },